{
  "format": "llm-foundations-e01-receipt-v1",
  "template_sha256": "aaaaaaaaaaaaaaaaaaaaaaaaaaaaaaaaaaaaaaaaaaaaaaaaaaaaaaaaaaaaaaaa",
  "edited_source_sha256": "bbbbbbbbbbbbbbbbbbbbbbbbbbbbbbbbbbbbbbbbbbbbbbbbbbbbbbbbbbbbbbbb",
  "normalized_diff_sha256": "cccccccccccccccccccccccccccccccccccccccccccccccccccccccccccccccc",
  "harness_version": "1.0.0",
  "tests": [
    {
      "id": "E01-T01-SHARED-IDENTITY",
      "status": "passed",
      "observed": "ok"
    },
    {
      "id": "E01-T02-PARAM-DELTA",
      "status": "passed",
      "observed": "ok"
    },
    {
      "id": "E01-T03-FORWARD-SHAPE-FINITE",
      "status": "passed",
      "observed": "ok"
    },
    {
      "id": "E01-T04-CAUSAL-INVARIANCE",
      "status": "passed",
      "observed": "ok"
    },
    {
      "id": "E01-T05-SAVE-LOAD",
      "status": "passed",
      "observed": "ok"
    },
    {
      "id": "E01-T06-CHECKPOINT-COMPAT",
      "status": "passed",
      "observed": "ok"
    }
  ],
  "python_version": "3.12.3",
  "torch_version": "2.8.0+cpu",
  "architecture_profile_id": "tiny-v2-weight-tied-v1",
  "architecture_variant": "tiny-v2-tied-v1",
  "logs": {
    "stdout_sha256": "dddddddddddddddddddddddddddddddddddddddddddddddddddddddddddddddd",
    "stdout_truncated": false,
    "stderr_sha256": "eeeeeeeeeeeeeeeeeeeeeeeeeeeeeeeeeeeeeeeeeeeeeeeeeeeeeeeeeeeeeeee",
    "stderr_truncated": false
  },
  "started_at": "2026-09-28T12:00:00.000Z",
  "finished_at": "2026-09-28T12:01:00.000Z",
  "status": "passed"
}
